{
  "contract_id": "SF-CON-PAYMENT-CALLBACK",
  "contract_status": "FROZEN",
  "freeze_status": "FROZEN",
  "tenant_id": "11111111-1111-4111-8111-111111111111",
  "callback_id": "44444444-4444-4444-8444-444444444444",
  "payment_intent_id": "66666666-6666-4666-8666-666666666666",
  "application_id": "33333333-3333-4333-8333-333333333333",
  "workflow_signal_ref": "payment.verified.signal",
  "verification_result": "VERIFIED",
  "signature_verified": true,
  "financial_effect_applied": true,
  "duplicate_financial_effect_forbidden": true,
  "exactly_once_key": "pay-cb-once-001",
  "idempotency_key": "pay-cb-demo-001"
}
